{
  "review_id": "R2",
  "reviewer_role": "R2",
  "model": "OpenAI Codex (GPT-5)",
  "reasoning_level": "xhigh",
  "bundle_sha256": "ac97cdacc140c7bcb186672aa63d002acc1658c767775a3d0718b406f17728e2",
  "plan_sha256": "a64a14c31b1c6ba87087102edc858d0ed5a336e6dd8f13f191d905207abe9a79",
  "plan_bytes": 46234,
  "started_utc": "2026-08-27T05:52:12.9901027Z",
  "completed_utc": "2026-08-27T05:58:43.192Z",
  "verdict": "CHANGES_REQUIRED",
  "findings": [
    {
      "finding_id": "R2-001",
      "severity": "P1",
      "affected_section": "§3 «Источники истины и фиксация baseline»; D2; D5; §21",
      "claim": "Frozen review не привязан к exact supply-chain lock, который реально будет исполняться.",
      "evidence": "§3 требует до будущего исполнения записать installer version/URL/signature/SHA-256 и image tags/digests, но D2 и D5 выбирают exact Docker Desktop build/channel и registry digests уже после review/approval. §21 оставляет exact Docker Desktop version/build открытым вопросом; D5 называет n8n 2.36.7 и PostgreSQL 17.11-alpine3.24 лишь proposed baseline. Нет правила, что acquisition record/lock сам замораживается, получает hash, проходит независимое review и что любое изменение версии/digest/license/source аннулирует прежний authorization.",
      "impact": "Кворум может одобрить v1, а затем исполнитель выберет и запустит артефакты, которых reviewers и владелец не видели. Подмена, срочная замена withdrawn image или обычный version drift неотличимы от разрешённого исполнения; результат нерепродуцируем.",
      "required_resolution": "Ввести до download/pull отдельный immutable SupplyChainLock: canonical fully qualified refs, Docker Desktop build/channel/effective URL/expected SHA-256/signer policy, OCI index и linux/amd64 child digests, source revisions, license-record IDs, lockfiles, SBOM/scan policy и tool versions. Зафиксировать bytes+SHA-256, дать владельцу и независимому reviewer на явное одобрение, привязать authorization к hash lock. Любое изменение поля требует нового lock и повторного disposition до исполнения.",
      "acceptance_test": "Положительный тест: D2/D5 принимают только lock с утверждённым hash и все evidence ссылаются на него. Негативный тест: изменить Docker build, URL, один OCI digest, source revision или policy ID после approval — download/pull/start обязаны завершиться BLOCKED до нового review/authorization.",
      "blocking": true,
      "confidence": "high"
    },
    {
      "finding_id": "R2-002",
      "severity": "P1",
      "affected_section": "D2 «Supply-chain lock и установка Docker Desktop»; §16; §17; 08_PRIMARY_SOURCES.md",
      "claim": "Installer verification не задаёт однозначный trust root и fail-closed Authenticode/checksum policy.",
      "evidence": "D2 фиксирует лишь «published checksum/signature source» и «expected Authenticode publisher», а после download требует SHA-256 match, Authenticode status valid и publisher exact-match. Не определены независимый источник expected digest, canonical publisher identity, допустимые signers, Code Signing EKU, chain policy/root store, trusted timestamp, revocation/OCSP/CRL status, multiple signatures и поведение при недоступной revocation check. 08_PRIMARY_SOURCES.md прямо говорит, что exact current hash/publisher certificate не проверены и требуют live verification.",
      "impact": "Разные исполнители могут по-разному трактовать Valid/publisher, получить expected hash из того же недоверенного payload/channel либо fail-open при неполной chain/revocation проверке. Это разрушает доказательство official provenance до запуска кода с повышенными правами.",
      "required_resolution": "Определить verifier contract: expected SHA-256 берётся из отдельно аутентифицированного official vendor metadata/source и никогда из downloaded file; canonical vendor origin и signer identity подтверждаются official source. Проверять embedded signatures, Code Signing EKU, полную доверенную цепочку, trusted timestamp/signing time, revocation status на дату acquisition и отсутствие неожиданного signer. Зафиксировать structured chain/source evidence без PII. Если vendor не публикует independent digest либо chain/revocation нельзя проверить, остановиться и вынести альтернативный acquisition method на отдельное review, а не ослаблять gate.",
      "acceptance_test": "На контролируемых fixtures только expected vendor-signed artifact проходит. One-byte mutation, корректно подписанный файл другого publisher, untrusted/expired/revoked signer, недоверенный timestamp, неизвестная дополнительная signature, unavailable independent checksum source и unavailable mandatory revocation check дают STOP/BLOCKED до install.",
      "blocking": true,
      "confidence": "high"
    },
    {
      "finding_id": "R2-003",
      "severity": "P1",
      "affected_section": "D2; §15 Download rollback; §16 installer mismatch stop condition",
      "claim": "Между проверкой installer и запуском остаётся TOCTOU, а mismatch deletion не защищён от path/reparse substitution.",
      "evidence": "D2 разделяет «после download до запуска» проверки и последующую установку, но не требует private staging directory, ACL, file identity, reparse-point check, exclusive custody или повторный hash/signature check непосредственно перед process creation. При mismatch предписано удалить downloaded installer по exact path; §15 повторяет это, но exact string path не доказывает, что final target не был заменён или перенаправлен через junction/reparse point.",
      "impact": "Локальный процесс или иной субъект с доступом к download path может заменить прошедшие проверку bytes перед запуском. При гонке/перенаправлении cleanup может воздействовать не на тот объект; supply-chain STOP не гарантирует безопасного удаления.",
      "required_resolution": "Скачивать в новый user-only staging directory с проверенным owner/ACL и без reparse ancestors; создавать уникальный файл без перезаписи, фиксировать canonical final path, volume/file ID, size и timestamps. Перед запуском заново проверить identity, SHA-256 и Authenticode, затем исполнять только абсолютный verified path без shell resolution. Mismatch artifact удалять или изолировать только после повторной проверки containment/identity; при изменении identity ничего не запускать и не удалять вне staging, сохранить только безопасные metadata/hash evidence.",
      "acceptance_test": "После первой проверки заменить файл, изменить ACL, подменить parent на junction/reparse target и сменить file ID. Во всех случаях install не стартует. Cleanup удаляет только первоначальный объект внутри проверенного staging; sentinel вне staging остаётся неизменным. Неизменённый artifact повторно проходит hash/signature и запускается по точному пути.",
      "blocking": true,
      "confidence": "high"
    },
    {
      "finding_id": "R2-004",
      "severity": "P1",
      "affected_section": "D5 «Image supply-chain lock»; §3; §17 Supply chain",
      "claim": "OCI provenance и exact linux/amd64 pinning сформулированы неоднозначно и не идентифицируют доверенный repository/leaf manifest.",
      "evidence": "D5 говорит «official registries» и «resolve exact registry digest для linux/amd64», но не задаёт canonical fully qualified repositories, доказательство владения namespace, различие multi-arch index digest и linux/amd64 child-manifest digest, config digest, registry mirror/proxy inventory или проверку vendor OCI signatures/attestations. Не сказано, что Compose pins именно approved leaf and platform и что SBOM/scan относится к тому же leaf. Для locally built bridge/mocks output image digest также явно не фиксируется.",
      "impact": "Одинаковый tag/name в другом namespace, index вместо выбранного platform manifest или пересобранный local tag может пройти формальный gate. Reviewer не сможет доказать, какие именно amd64 bytes были запущены и просканированы.",
      "required_resolution": "Для каждого vendor/base/local image записать canonical FQIN, official-source proof namespace, registry endpoint/mirror state, tag, OCI index digest, linux/amd64 child-manifest digest, config digest, size и UTC. Compose должен содержать approved digest plus explicit platform; pull/import должен сверять resolved child/config and runtime OS/architecture. Проверять vendor signature/provenance attestation, если vendor её публикует; если нет — явно зафиксировать отсутствие и residual approval. SBOM, vulnerability disposition и runtime evidence привязать к child manifest. Local builds также адресовать output digest, не mutable tag.",
      "acceptance_test": "Fixture с одинаковым short name в другом registry, multi-arch index с другим amd64 child, wrong architecture и mutable local tag должен быть отклонён. `compose config`, registry-manifest evidence и `image inspect` должны однозначно сходиться на одном FQIN/index/amd64-child/config tuple; start с любым иным tuple блокируется.",
      "blocking": true,
      "confidence": "high"
    },
    {
      "finding_id": "R2-005",
      "severity": "P1",
      "affected_section": "D4; D5 bridge/mocks; §17 Supply chain",
      "claim": "Dependency lock для custom bridge/mocks не является полным и воспроизводимым build contract.",
      "evidence": "Единственное требование D5: reviewed source, pinned base digest и «dependency lock; либо dependency-free standard runtime». Нет правил для transitive npm integrity, `npm ci`, lifecycle scripts, Git/URL dependencies, apt repositories/snapshots/package versions, remote `ADD`, pinned Dockerfile frontend/builder, build network, cache trust, generated assets, build context hash, output provenance/attestation и секретов BuildKit. Формулировка «dependency-free standard runtime» не определяет проверяемый критерий.",
      "impact": "Две сборки из одного reviewed source могут получить разные или вредоносные dependencies; lock может существовать номинально, но не управлять всеми fetched materials. SBOM после факта не делает сборку аутентичной или повторяемой.",